Title,Body,Image,Created,Promote
Call Us For an Appointment Today!,<p>800.888.CARE</p>,CTAbackground.jpg,,0
Need more patient and visitor information?,<p>Call 800.888.CARE</p>,CTAbackground.jpg,,0
Need help choosing a doctor?,<p>Call 800.888.CARE to learn more about our physicians</p>,CTAbackground.jpg,,0
Want to get the most current ER wait times?,<p>Call 800.888.CARE for real-time ER wait times</p>,CTAbackground.jpg,,0
Need to schedule an appointment?,<p>Call 800.888.CARE</p>,CTAbackground.jpg,,0
Need to contact us by phone?,<p>Call 800.888.CARE to speak to a Baypoint Medical representative today</p>,CTAbackground.jpg,,0
"San Diego's #1 Hospital","Accomplishments, Accolades, and Awards Recognized by U.S. News and World Report as",CTAbackground.jpg,,1